[
  {
    "schema_version": "iteration_efficiency_result_v1",
    "method": "Proposed",
    "method_variant": "proposed",
    "mesh": "160x20",
    "nelx": 160,
    "nely": 20,
    "element_count": 3200,
    "q": 0.98,
    "P": 100,
    "B0": 900,
    "B_ref": 3200,
    "b_ref": 2100,
    "B_meas": 3200,
    "tail_truncated": false,
    "k_enter": 110,
    "k_cert": 209,
    "status": "PASS",
    "censoring_reason": "",
    "E1": 161,
    "E2": 161,
    "E3": 161,
    "Q": 0.99,
    "topology_pass": true,
    "volume_pass": true,
    "hard_gate_pass": true,
    "native_iterations": 110,
    "yuksel_stage1_iterations": null,
    "yuksel_stage2_iterations": null,
    "yuksel_total_iterations": null,
    "olhoff_outer_updates": null,
    "olhoff_lp_calls": null,
    "olhoff_lp_backend_iterations": null,
    "olhoff_failed_lp_calls": null,
    "olhoff_mma_total_inner_iterations": null,
    "olhoff_mma_mean_inner_iterations": null,
    "olhoff_mma_median_inner_iterations": null,
    "olhoff_mma_p95_inner_iterations": null,
    "olhoff_mma_max_inner_iterations": null,
    "olhoff_mma_cap_hit_count": null,
    "olhoff_mma_cap_hit_fraction": null,
    "olhoff_mma_converged_inner_count": null,
    "olhoff_mma_converged_inner_fraction": null,
    "native_total_time": 2,
    "native_total_time_to_enter": 2,
    "native_total_time_to_cert": 3,
    "mean_native_iteration_time": 0.018181818181818181,
    "trajectory_dtype": "double",
    "evaluator_id": "candidate_c_adaptive_structural_mode_v1",
    "contract_hash": "cc900b4ad4cae18b0bcd9b7a559f51e04e5167db587f64180b371d3c399bf95b",
    "source_hashes": {
      "evaluator": "e14a21efe0bb2d9b9d7f3187b4c3f671ec089f6ff96773074b8f3b56cacd79e9"
    },
    "provenance_hash": "",
    "error_identifier": "",
    "error_message": ""
  },
  {
    "schema_version": "iteration_efficiency_result_v1",
    "method": "Proposed",
    "method_variant": "proposed",
    "mesh": "160x20",
    "nelx": 160,
    "nely": 20,
    "element_count": 3200,
    "q": 0.99,
    "P": 100,
    "B0": 900,
    "B_ref": 3200,
    "b_ref": 2100,
    "B_meas": 3200,
    "tail_truncated": false,
    "k_enter": 110,
    "k_cert": 209,
    "status": "PASS",
    "censoring_reason": "",
    "E1": 161,
    "E2": 161,
    "E3": 161,
    "Q": 0.99,
    "topology_pass": true,
    "volume_pass": true,
    "hard_gate_pass": true,
    "native_iterations": 110,
    "yuksel_stage1_iterations": null,
    "yuksel_stage2_iterations": null,
    "yuksel_total_iterations": null,
    "olhoff_outer_updates": null,
    "olhoff_lp_calls": null,
    "olhoff_lp_backend_iterations": null,
    "olhoff_failed_lp_calls": null,
    "olhoff_mma_total_inner_iterations": null,
    "olhoff_mma_mean_inner_iterations": null,
    "olhoff_mma_median_inner_iterations": null,
    "olhoff_mma_p95_inner_iterations": null,
    "olhoff_mma_max_inner_iterations": null,
    "olhoff_mma_cap_hit_count": null,
    "olhoff_mma_cap_hit_fraction": null,
    "olhoff_mma_converged_inner_count": null,
    "olhoff_mma_converged_inner_fraction": null,
    "native_total_time": 2,
    "native_total_time_to_enter": 2,
    "native_total_time_to_cert": 3,
    "mean_native_iteration_time": 0.018181818181818181,
    "trajectory_dtype": "double",
    "evaluator_id": "candidate_c_adaptive_structural_mode_v1",
    "contract_hash": "cc900b4ad4cae18b0bcd9b7a559f51e04e5167db587f64180b371d3c399bf95b",
    "source_hashes": {
      "evaluator": "e14a21efe0bb2d9b9d7f3187b4c3f671ec089f6ff96773074b8f3b56cacd79e9"
    },
    "provenance_hash": "",
    "error_identifier": "",
    "error_message": ""
  },
  {
    "schema_version": "iteration_efficiency_result_v1",
    "method": "Proposed",
    "method_variant": "proposed",
    "mesh": "160x20",
    "nelx": 160,
    "nely": 20,
    "element_count": 3200,
    "q": 0.995,
    "P": 100,
    "B0": 900,
    "B_ref": 3200,
    "b_ref": 2100,
    "B_meas": 3200,
    "tail_truncated": false,
    "k_enter": 110,
    "k_cert": 209,
    "status": "PASS",
    "censoring_reason": "",
    "E1": 161,
    "E2": 161,
    "E3": 161,
    "Q": 0.99,
    "topology_pass": true,
    "volume_pass": true,
    "hard_gate_pass": true,
    "native_iterations": 110,
    "yuksel_stage1_iterations": null,
    "yuksel_stage2_iterations": null,
    "yuksel_total_iterations": null,
    "olhoff_outer_updates": null,
    "olhoff_lp_calls": null,
    "olhoff_lp_backend_iterations": null,
    "olhoff_failed_lp_calls": null,
    "olhoff_mma_total_inner_iterations": null,
    "olhoff_mma_mean_inner_iterations": null,
    "olhoff_mma_median_inner_iterations": null,
    "olhoff_mma_p95_inner_iterations": null,
    "olhoff_mma_max_inner_iterations": null,
    "olhoff_mma_cap_hit_count": null,
    "olhoff_mma_cap_hit_fraction": null,
    "olhoff_mma_converged_inner_count": null,
    "olhoff_mma_converged_inner_fraction": null,
    "native_total_time": 2,
    "native_total_time_to_enter": 2,
    "native_total_time_to_cert": 3,
    "mean_native_iteration_time": 0.018181818181818181,
    "trajectory_dtype": "double",
    "evaluator_id": "candidate_c_adaptive_structural_mode_v1",
    "contract_hash": "cc900b4ad4cae18b0bcd9b7a559f51e04e5167db587f64180b371d3c399bf95b",
    "source_hashes": {
      "evaluator": "e14a21efe0bb2d9b9d7f3187b4c3f671ec089f6ff96773074b8f3b56cacd79e9"
    },
    "provenance_hash": "",
    "error_identifier": "",
    "error_message": ""
  },
  {
    "schema_version": "iteration_efficiency_result_v1",
    "method": "Proposed",
    "method_variant": "proposed",
    "mesh": "160x20",
    "nelx": 160,
    "nely": 20,
    "element_count": 3200,
    "q": 0.98,
    "P": 50,
    "B0": 900,
    "B_ref": 3200,
    "b_ref": 2100,
    "B_meas": 3200,
    "tail_truncated": false,
    "k_enter": 110,
    "k_cert": 159,
    "status": "PASS",
    "censoring_reason": "",
    "E1": 161,
    "E2": 161,
    "E3": 161,
    "Q": 0.99,
    "topology_pass": true,
    "volume_pass": true,
    "hard_gate_pass": true,
    "native_iterations": 110,
    "yuksel_stage1_iterations": null,
    "yuksel_stage2_iterations": null,
    "yuksel_total_iterations": null,
    "olhoff_outer_updates": null,
    "olhoff_lp_calls": null,
    "olhoff_lp_backend_iterations": null,
    "olhoff_failed_lp_calls": null,
    "olhoff_mma_total_inner_iterations": null,
    "olhoff_mma_mean_inner_iterations": null,
    "olhoff_mma_median_inner_iterations": null,
    "olhoff_mma_p95_inner_iterations": null,
    "olhoff_mma_max_inner_iterations": null,
    "olhoff_mma_cap_hit_count": null,
    "olhoff_mma_cap_hit_fraction": null,
    "olhoff_mma_converged_inner_count": null,
    "olhoff_mma_converged_inner_fraction": null,
    "native_total_time": 2,
    "native_total_time_to_enter": 2,
    "native_total_time_to_cert": 3,
    "mean_native_iteration_time": 0.018181818181818181,
    "trajectory_dtype": "double",
    "evaluator_id": "candidate_c_adaptive_structural_mode_v1",
    "contract_hash": "cc900b4ad4cae18b0bcd9b7a559f51e04e5167db587f64180b371d3c399bf95b",
    "source_hashes": {
      "evaluator": "e14a21efe0bb2d9b9d7f3187b4c3f671ec089f6ff96773074b8f3b56cacd79e9"
    },
    "provenance_hash": "",
    "error_identifier": "",
    "error_message": ""
  },
  {
    "schema_version": "iteration_efficiency_result_v1",
    "method": "Proposed",
    "method_variant": "proposed",
    "mesh": "160x20",
    "nelx": 160,
    "nely": 20,
    "element_count": 3200,
    "q": 0.99,
    "P": 50,
    "B0": 900,
    "B_ref": 3200,
    "b_ref": 2100,
    "B_meas": 3200,
    "tail_truncated": false,
    "k_enter": 110,
    "k_cert": 159,
    "status": "PASS",
    "censoring_reason": "",
    "E1": 161,
    "E2": 161,
    "E3": 161,
    "Q": 0.99,
    "topology_pass": true,
    "volume_pass": true,
    "hard_gate_pass": true,
    "native_iterations": 110,
    "yuksel_stage1_iterations": null,
    "yuksel_stage2_iterations": null,
    "yuksel_total_iterations": null,
    "olhoff_outer_updates": null,
    "olhoff_lp_calls": null,
    "olhoff_lp_backend_iterations": null,
    "olhoff_failed_lp_calls": null,
    "olhoff_mma_total_inner_iterations": null,
    "olhoff_mma_mean_inner_iterations": null,
    "olhoff_mma_median_inner_iterations": null,
    "olhoff_mma_p95_inner_iterations": null,
    "olhoff_mma_max_inner_iterations": null,
    "olhoff_mma_cap_hit_count": null,
    "olhoff_mma_cap_hit_fraction": null,
    "olhoff_mma_converged_inner_count": null,
    "olhoff_mma_converged_inner_fraction": null,
    "native_total_time": 2,
    "native_total_time_to_enter": 2,
    "native_total_time_to_cert": 3,
    "mean_native_iteration_time": 0.018181818181818181,
    "trajectory_dtype": "double",
    "evaluator_id": "candidate_c_adaptive_structural_mode_v1",
    "contract_hash": "cc900b4ad4cae18b0bcd9b7a559f51e04e5167db587f64180b371d3c399bf95b",
    "source_hashes": {
      "evaluator": "e14a21efe0bb2d9b9d7f3187b4c3f671ec089f6ff96773074b8f3b56cacd79e9"
    },
    "provenance_hash": "",
    "error_identifier": "",
    "error_message": ""
  },
  {
    "schema_version": "iteration_efficiency_result_v1",
    "method": "Proposed",
    "method_variant": "proposed",
    "mesh": "160x20",
    "nelx": 160,
    "nely": 20,
    "element_count": 3200,
    "q": 0.995,
    "P": 50,
    "B0": 900,
    "B_ref": 3200,
    "b_ref": 2100,
    "B_meas": 3200,
    "tail_truncated": false,
    "k_enter": 110,
    "k_cert": 159,
    "status": "PASS",
    "censoring_reason": "",
    "E1": 161,
    "E2": 161,
    "E3": 161,
    "Q": 0.99,
    "topology_pass": true,
    "volume_pass": true,
    "hard_gate_pass": true,
    "native_iterations": 110,
    "yuksel_stage1_iterations": null,
    "yuksel_stage2_iterations": null,
    "yuksel_total_iterations": null,
    "olhoff_outer_updates": null,
    "olhoff_lp_calls": null,
    "olhoff_lp_backend_iterations": null,
    "olhoff_failed_lp_calls": null,
    "olhoff_mma_total_inner_iterations": null,
    "olhoff_mma_mean_inner_iterations": null,
    "olhoff_mma_median_inner_iterations": null,